ID,Name,TermTranslation,Background,InventedBy,InventedByMemberID,ObjectID,StatusID,PageHits,BackgroundNoHtml
73,בריכת עפר,"בריכת אגירה בלב השדות ומרכז לוגיסטי של עג""ש","בשנות ה- 50 כשנוסד עג""ש על ענפי המספוא הפלחה וגן הירק הוקמה מערכת השקיה, נחפרו בארות נמתחו קוי מים ונחפרה בריכה גדולה בין גוש 7, 2, 1 ו- 6. ליד הבריכה נבנה צריף בו אכלו חברי הענף ארוחת בוקר ורוכזו צינורות ההשקיה. עומק הבריכה אליה ניתן היה להכניס כ- 6000 קוב היה כ- 3 מטר, קו של 6 צול חיבר אותה לתעלות ההשקיה בהצפה. עד מהרה  הפכה הבריכה לאתנחתא רטובה לימי הקיץ לחברי וילדי הענף ויעד מועדף לטיולים בשדות.
נסיון חביב היה כאשר הכניסו אליה דגיגי קרפיונים אותם היו דגים בחדווה דייגים חובבים בשבת ובחג ",עממי,-1,4,2,1982,"בשנות ה- 50 כשנוסד עג""ש על ענפי המספוא הפלחה וגן הירק הוקמה מערכת השקיה, נחפרו בארות נמתחו קוי מים ונחפרה בריכה גדולה בין גוש 7, 2, 1 ו- 6. ליד הבריכה נבנה צריף בו אכלו חברי הענף ארוחת בוקר ורוכזו צינורות ההשקיה. עומק הבריכה אליה ניתן היה להכניס כ- 6000 קוב היה כ- 3 מטר, קו של 6 צול חיבר אותה לתעלות ההשקיה בהצפה. עד מהרה  הפכה הבריכה לאתנחתא רטובה לימי הקיץ לחברי וילדי הענף ויעד מועדף לטיולים בשדות.
נסיון חביב היה כאשר הכניסו אליה דגיגי קרפיונים אותם היו דגים בחדווה דייגים חובבים בשבת ובחג "
74,גזר חי,פיסות גזר חתוכות דק במרינדת מיץ הדרן,"הרצון הגדול להינות מהחיים גם שהאמצעים דלים ביותר הביא את טבחיות הקיבוץ לפרץ יצירתיות שהופנה גם למנות האחרונות, ובראשן ה'גזר החי'. את הגזר היו מקלפים, ומגרדים בפומפיה את שבביו לתוך סיר גדול. אחר כך היו ממלאים סיר גדול במיץ תפוזים, קצת סוכר ומים ושופכים פנימה את הגזר החי. בקידמת עגלת ה'ונציה' היה מגש שבו היו עומדות צלוחיות הגזר החי וכל חבר היה מקבל אחת. אם יש קונצנזוס באוכל, אז ללא ספק הוא מצוי סביב ה'גזר החי' שכל מי שאכל-שתה אותו, לא ישכח טעמו, ולעזאזל האימרה: ""טוב הברווז המת מהגזר החי.."" ",עממי,-1,4,2,2196,"הרצון הגדול להינות מהחיים גם שהאמצעים דלים ביותר הביא את טבחיות הקיבוץ לפרץ יצירתיות שהופנה גם למנות האחרונות, ובראשן ה'גזר החי'. את הגזר היו מקלפים, ומגרדים בפומפיה את שבביו לתוך סיר גדול. אחר כך היו ממלאים סיר גדול במיץ תפוזים, קצת סוכר ומים ושופכים פנימה את הגזר החי. בקידמת עגלת ה'ונציה' היה מגש שבו היו עומדות צלוחיות הגזר החי וכל חבר היה מקבל אחת. אם יש קונצנזוס באוכל, אז ללא ספק הוא מצוי סביב ה'גזר החי' שכל מי שאכל-שתה אותו, לא ישכח טעמו, ולעזאזל האימרה: ""טוב הברווז המת מהגזר החי.."" "
75,איזולציה,חדרי חולים,"החלוצים שהגיעו מאירופה הקפואה אל ארץ ישראל הצחיחה והיוקדת, מבית חם אל אוהל פרוץ לכל רוח, חלו כבר בשבוע הראשון בקדחת, אנגינה ושאר מרעין בישין. באוהל היה צפוף וקר ולכן פינו צריף אחד ואחרי שהוקם ה'בית הגדול',הוכן חדר מיוחד בו הושכבו החולים בבידוד מהבריאים. כאשר נולדו הילדים הראשונים הוקמה איזולציה גם עבור הקטנים שהדאגה לבריאותם היתה בראש מעייני הכל. בחלוף השנים הוקמו ב'בתי הסוכנות' איזולציה לחברים ואחת לילדים ועל כל מחלה קטנה היו מועברים הקטנים מבית הילדים או הבית הכולל לשם, עד שהבריאו.","איזולציה בלועזית - בידוד, ניתוק מהסביבה",-1,4,2,2066,"החלוצים שהגיעו מאירופה הקפואה אל ארץ ישראל הצחיחה והיוקדת, מבית חם אל אוהל פרוץ לכל רוח, חלו כבר בשבוע הראשון בקדחת, אנגינה ושאר מרעין בישין. באוהל היה צפוף וקר ולכן פינו צריף אחד ואחרי שהוקם ה'בית הגדול',הוכן חדר מיוחד בו הושכבו החולים בבידוד מהבריאים. כאשר נולדו הילדים הראשונים הוקמה איזולציה גם עבור הקטנים שהדאגה לבריאותם היתה בראש מעייני הכל. בחלוף השנים הוקמו ב'בתי הסוכנות' איזולציה לחברים ואחת לילדים ועל כל מחלה קטנה היו מועברים הקטנים מבית הילדים או הבית הכולל לשם, עד שהבריאו."
76,ונציה,עגלה מחוממת לחלוקת אוכל בצהריים,"הרבה דמיון ושמש נדרשו להמצאת השם 'ונציה' - העגלה המיתולוגית שסבבה בין שולחנות חדר האוכל בארוחת צהריים ותורניה חילקו אוכל חם לחברי וילדי הקיבוץ. את ה'ונציה' היו מחברים ל'קיטור' שהיה מחמם את התאים(גונדולות?) השונים, בהם היו ממלאים מרק ובשר, ירקות מבושלים, צמחוני וכיו""ב. כל תורן היה מגיש לצד אחד של השביל,על צידי העגלה היה רשום התפריט היומי. בערבי שישי היה 'קרב' בין התורנים לחברים שרצו למלא את המנאז' (עיין ערך) כדי לקחת אוכל הביתה. בימי בשר שטוח (ע""ע) המלחמה היתה מחריפה ותושיה רבה  נדרשה מהתורנים...","לא ידוע, בינתיים",-1,4,2,2063,"הרבה דמיון ושמש נדרשו להמצאת השם 'ונציה' - העגלה המיתולוגית שסבבה בין שולחנות חדר האוכל בארוחת צהריים ותורניה חילקו אוכל חם לחברי וילדי הקיבוץ. את ה'ונציה' היו מחברים ל'קיטור' שהיה מחמם את התאים(גונדולות?) השונים, בהם היו ממלאים מרק ובשר, ירקות מבושלים, צמחוני וכיו""ב. כל תורן היה מגיש לצד אחד של השביל,על צידי העגלה היה רשום התפריט היומי. בערבי שישי היה 'קרב' בין התורנים לחברים שרצו למלא את המנאז' (עיין ערך) כדי לקחת אוכל הביתה. בימי בשר שטוח (ע""ע) המלחמה היתה מחריפה ותושיה רבה  נדרשה מהתורנים..."
77,חביבה (בפ' דגושה),"טובה, ליטוף אוהב על ראש ילד, חבר, זקן ובעל חי","ילדי הקיבוץ היו מאז ומעולם ילדים של כולם, וכל מבוגר היה נוהג ללטף את ראשם או לצבוט בלחיים. להרגל קצת דביק זה קראו - לעשות חביבה (בפ' דגושה). באותם ימים של תמימות כשהמושג 'הטרדה' עוד לא עלה על שולחן האקדמיה, נגעו האנשים אחד בשני יותר כאשר ה'סובלים' העיקריים מחביבות זו היו הילדים. עם התקרבות העיר אל חצר הקיבוץ חדרו לשטח הטריטוריאלי גם מושגים 'עירוניים' שרובם נהדפו מעבר ל'סימטה'. אחד מהם, אולי המעצבן מכולם היה..לעשות טובה: ""טובה, בוא חמודי, תעשה טובה לעיזה/דפנה/דני"",היפוכו הגמור של חביבה המתוק שלנו",בערבית: יא חביבי - כינוי חיבה ידידותי,-1,4,2,1927,"ילדי הקיבוץ היו מאז ומעולם ילדים של כולם, וכל מבוגר היה נוהג ללטף את ראשם או לצבוט בלחיים. להרגל קצת דביק זה קראו - לעשות חביבה (בפ' דגושה). באותם ימים של תמימות כשהמושג 'הטרדה' עוד לא עלה על שולחן האקדמיה, נגעו האנשים אחד בשני יותר כאשר ה'סובלים' העיקריים מחביבות זו היו הילדים. עם התקרבות העיר אל חצר הקיבוץ חדרו לשטח הטריטוריאלי גם מושגים 'עירוניים' שרובם נהדפו מעבר ל'סימטה'. אחד מהם, אולי המעצבן מכולם היה..לעשות טובה: ""טובה, בוא חמודי, תעשה טובה לעיזה/דפנה/דני"",היפוכו הגמור של חביבה המתוק שלנו"
78,כלבוייניק,כלי שולחן לסילוק שיירי אוכל ולכלוך. ציבורית ..,"שניים מהמשפטים הראשונים שלומד כל ילד, גם בקיבוץ : ש""אסור לזרוק אוכל.."" ו""לכלוך זורקים בפח"" - ולכן כלי שתמיד היה על השולחן, זה ה'כלבוייניק'. בדר""כ עשוי מפלסטיק ולעיתים מנירוסטה, שאב הכלי החביב את קליפות הפירות, עצמות העוף או הדג, הביצים ומה לא? ילדים וחברים שהאוכל לא 'ערב לחיכם' היו מביטים לצדדים, מוודאים שאיש לא יראה, ו..מניחים בכלבוייניק את האוכל, רחמנא ליצלן.. כשבגר הנוער ויצא לצבא או עזב לעיר נתקלו לא מעטים במילה הדי מנוכרת: 'ציבורית', והכלבוייניק הנאמן שב והבליח  בזכרונם. ",עממי,-1,4,2,1968,"שניים מהמשפטים הראשונים שלומד כל ילד, גם בקיבוץ : ש""אסור לזרוק אוכל.."" ו""לכלוך זורקים בפח"" - ולכן כלי שתמיד היה על השולחן, זה ה'כלבוייניק'. בדר""כ עשוי מפלסטיק ולעיתים מנירוסטה, שאב הכלי החביב את קליפות הפירות, עצמות העוף או הדג, הביצים ומה לא? ילדים וחברים שהאוכל לא 'ערב לחיכם' היו מביטים לצדדים, מוודאים שאיש לא יראה, ו..מניחים בכלבוייניק את האוכל, רחמנא ליצלן.. כשבגר הנוער ויצא לצבא או עזב לעיר נתקלו לא מעטים במילה הדי מנוכרת: 'ציבורית', והכלבוייניק הנאמן שב והבליח  בזכרונם. "
79,של מי אתה ? (במבטא ייקי),"מי הם ההורים שלך, ילד ?","הקיבוץ הגדול ביותר בעולם היה גם כנראה מקום ריכוז הייקים הגדול בארץ והשילוב הזה הוליד לא מעט 'אינסידנטים'..הילודה הגבוהה בשנות ה- 40 וה- 50 הביאה אל שבילי הקיבוץ מאות ילדים והחברים שפעם הכירו כל נמש בפני הילד/נער וגם קצת התבגרו, החלו לאבד את בטחונם בנוגע לזהות הצעיר, ואז כמו 'סיסמא' היו פונים אל הצעיר/ה בשאלה מאיימת משהו: ""של מי אתה ילט? (במבטא..) הילדים היו עונים מיד, אך עם השנים פיתחו מענה קצת מתוחכם שהביך את השואל קשה ההבנה ו/או רפה הזכרון.. ילדים 'לא מפה' בכלל לא הבינו את השאלה..",ביטוי מקומי,-1,4,2,2144,"הקיבוץ הגדול ביותר בעולם היה גם כנראה מקום ריכוז הייקים הגדול בארץ והשילוב הזה הוליד לא מעט 'אינסידנטים'..הילודה הגבוהה בשנות ה- 40 וה- 50 הביאה אל שבילי הקיבוץ מאות ילדים והחברים שפעם הכירו כל נמש בפני הילד/נער וגם קצת התבגרו, החלו לאבד את בטחונם בנוגע לזהות הצעיר, ואז כמו 'סיסמא' היו פונים אל הצעיר/ה בשאלה מאיימת משהו: ""של מי אתה ילט? (במבטא..) הילדים היו עונים מיד, אך עם השנים פיתחו מענה קצת מתוחכם שהביך את השואל קשה ההבנה ו/או רפה הזכרון.. ילדים 'לא מפה' בכלל לא הבינו את השאלה.."
80,חדר עבודה,חדר המטפלת ב'טיינר' או ב'שורות',"על 'חדר העבודה' המיתולוגי בטיינר' וב'שורות' אפשר לומר כמעט הכל, חוץ מהעובדה שעבודה של ממש לא נעשתה שם...ב'חדר העבודה' היו תאים לבגדי הילדים, סלי כביסה ובעיקר..אוכל. 
חשיבותו העיקרית היתה כמקום כינוס ל'ארוחת עשר' של לחם וריבה/שוקולד, סקווש (ע""ע) ופטל, וכמובן מקום הבילוי העיקרי בלילות הארוכים והיפים של 'טיינר'..
בימי ראשון בבוקר היה נראה חדר העבודה כשדה קטל ואם היו 'זבובי הקיר' יכולים לספר מה קרה שם בשבתות..משרדי החינוך והבריאות, שלא לדבר על הנהלת בית ספר, היו סוגרים מיד את ה'אתר'. ",עוד המצאה מקורית של החינוך המשותף,-1,4,2,1871,"על 'חדר העבודה' המיתולוגי בטיינר' וב'שורות' אפשר לומר כמעט הכל, חוץ מהעובדה שעבודה של ממש לא נעשתה שם...ב'חדר העבודה' היו תאים לבגדי הילדים, סלי כביסה ובעיקר..אוכל. 
חשיבותו העיקרית היתה כמקום כינוס ל'ארוחת עשר' של לחם וריבה/שוקולד, סקווש (ע""ע) ופטל, וכמובן מקום הבילוי העיקרי בלילות הארוכים והיפים של 'טיינר'..
בימי ראשון בבוקר היה נראה חדר העבודה כשדה קטל ואם היו 'זבובי הקיר' יכולים לספר מה קרה שם בשבתות..משרדי החינוך והבריאות, שלא לדבר על הנהלת בית ספר, היו סוגרים מיד את ה'אתר'. "
81,דוכפה (בפא רפויה),"אהבל, טמבל אחד","מאז ומעולם שררו יחסי רעות ואחווה בין חברי הקיבוץ ובעיקר בין ילדיהם.. המטרה המשותפת, משא האחריות הקולקטיבית והלוקל פטריוטיות חיזקו תחושות אלו.. אבל, ברגעי לחץ וחולשה התגלעו סדקים ב'יחד' ואז, הוסרו המחסומים ונפתחו חרצובות הפה. לריכוך הביקורת ההדדית  הומצאו מילות גנאי 'רכות' שהחביבה מכל היתה 'דוכפה'. 
את הדוכפה הכניסו לשפה ילדי 'כיתת עליה' שכינו כך את אחד מחבריהם, עם הזמן  
הדוכפה היה זה שחלב את התיש, הדוכפה היה נופל מהסולם או מנסר את הענף שישב עליו וכשכולם ב'הורה' קפצו ימינה, הדוכפה קפץ שמאלה...","מקור מרוקאי, הובא ע""י ילדי כיתת עליה",-1,4,2,2036,"מאז ומעולם שררו יחסי רעות ואחווה בין חברי הקיבוץ ובעיקר בין ילדיהם.. המטרה המשותפת, משא האחריות הקולקטיבית והלוקל פטריוטיות חיזקו תחושות אלו.. אבל, ברגעי לחץ וחולשה התגלעו סדקים ב'יחד' ואז, הוסרו המחסומים ונפתחו חרצובות הפה. לריכוך הביקורת ההדדית  הומצאו מילות גנאי 'רכות' שהחביבה מכל היתה 'דוכפה'. 
את הדוכפה הכניסו לשפה ילדי 'כיתת עליה' שכינו כך את אחד מחבריהם, עם הזמן  
הדוכפה היה זה שחלב את התיש, הדוכפה היה נופל מהסולם או מנסר את הענף שישב עליו וכשכולם ב'הורה' קפצו ימינה, הדוכפה קפץ שמאלה..."
82,תחתית,אחד שתרומתו לקיבוץ נמוכה במיוחד,"""כל אחד נותן כפי יכולתו ולוקח לפי צרכיו"" היה מאז ומתמיד המוטו של הקיבוץ. לגבעת ברנר שקלטה יותר אנשים מכל קיבוץ הגיעו לאורך הדורות חברים שהרעיון הקיבוצי היה זר להם וכל חלומם היה 'להסתדר בחיים', בקיבוץ או עדיף מחוצה לו. בשל אילוצים שונים הם נשארו בגבעה,  בתור נפקדים נוכחים. לגיוסים הרבים הם לא הופיעו, בועדות המשק ובאסיפות הם לא נטלו חלק, התנדבות מחוץ לשעות העבודה, חבל על הזמן. התרומה המשמעותית של ה'תחתיות' ניכרה בענפי השירותים והצריכה. כל מה שהיה 'חופשי' הם לקחו בכמויות ותמיד הקפידו לקטר...",אולי 'חבורת שנוז' בסוף שנות ה- 70,-1,4,2,1997,"""כל אחד נותן כפי יכולתו ולוקח לפי צרכיו"" היה מאז ומתמיד המוטו של הקיבוץ. לגבעת ברנר שקלטה יותר אנשים מכל קיבוץ הגיעו לאורך הדורות חברים שהרעיון הקיבוצי היה זר להם וכל חלומם היה 'להסתדר בחיים', בקיבוץ או עדיף מחוצה לו. בשל אילוצים שונים הם נשארו בגבעה,  בתור נפקדים נוכחים. לגיוסים הרבים הם לא הופיעו, בועדות המשק ובאסיפות הם לא נטלו חלק, התנדבות מחוץ לשעות העבודה, חבל על הזמן. התרומה המשמעותית של ה'תחתיות' ניכרה בענפי השירותים והצריכה. כל מה שהיה 'חופשי' הם לקחו בכמויות ותמיד הקפידו לקטר..."
83,אצבעות,"מאכל פסטה מקומי, ניוקי לעניים..","יכולת האלתור והיצירתיות נדרשו לא מעט במטבח הקיבוצי, אבל היו גם כמה 'נפילות'. אחת מהן היתה התוספת שנקראה בפי כל - 'אצבעות'. צורתן דמויית האצבע של אותם גלילוני פסטה שתכונתם הבולטת ביותר היתה השמן הרב שהותירו בצלחת לא הפריעו לחברים הרעבים וילדיהם לאכול את ה'אצבעות' בפה מלא. מנה גדושה של רוטב עגבניות, קטשופ של היום, סייעה לא מעט בעיכול מנת מזון זו. ימי ה'אצבעות' העיקריים היו בשבת ושימשו 'תשובה קיבוצית ניצחת' לכמויות האורחים הגדולות בסופי השבוע..המומחיות להכנת ה'אצבעות' היו רבקה קלנסקי וחיה זיסקינד",ביטוי מחוזי למנה מקומית,-1,4,2,2019,"יכולת האלתור והיצירתיות נדרשו לא מעט במטבח הקיבוצי, אבל היו גם כמה 'נפילות'. אחת מהן היתה התוספת שנקראה בפי כל - 'אצבעות'. צורתן דמויית האצבע של אותם גלילוני פסטה שתכונתם הבולטת ביותר היתה השמן הרב שהותירו בצלחת לא הפריעו לחברים הרעבים וילדיהם לאכול את ה'אצבעות' בפה מלא. מנה גדושה של רוטב עגבניות, קטשופ של היום, סייעה לא מעט בעיכול מנת מזון זו. ימי ה'אצבעות' העיקריים היו בשבת ושימשו 'תשובה קיבוצית ניצחת' לכמויות האורחים הגדולות בסופי השבוע..המומחיות להכנת ה'אצבעות' היו רבקה קלנסקי וחיה זיסקינד"
84,פופו,קקי,"עולי גרמניה הראשונים, הייקים הביאו איתם שלל מילים וביטויים שהשתלבו היטב בשפה המדוברת. פופו בגרמנית הוא גם האיבר וגם התוצרת אותה הוא מפיק, ויחד עם אחיו הקליל - ה'פיפי' שמשו השניים את החלוצים וילדיהם. ""אם לא תתנהג יפה - תקבל על הפופו"" היה משפט ששמע כל ילד שני מהמטפלת, ""א. עשה פופו במכנסיים"" הוסיפה וסתמה את אפה. מול הקקי העירוני סר הטעם היה הפופו חביב ולא מאיים, כמעט בעל ניחוח ידידותי..
בני הגבעה נשאו איתם את ה'פופו' לכל מקום בעולם וכשניגבו את הקקי לילדיהם התנחמו בעובדה שזה בסך הכל פופו ריחני... ",מילה בגרמנית שהביאו הייקים,-1,4,2,2335,"עולי גרמניה הראשונים, הייקים הביאו איתם שלל מילים וביטויים שהשתלבו היטב בשפה המדוברת. פופו בגרמנית הוא גם האיבר וגם התוצרת אותה הוא מפיק, ויחד עם אחיו הקליל - ה'פיפי' שמשו השניים את החלוצים וילדיהם. ""אם לא תתנהג יפה - תקבל על הפופו"" היה משפט ששמע כל ילד שני מהמטפלת, ""א. עשה פופו במכנסיים"" הוסיפה וסתמה את אפה. מול הקקי העירוני סר הטעם היה הפופו חביב ולא מאיים, כמעט בעל ניחוח ידידותי..
בני הגבעה נשאו איתם את ה'פופו' לכל מקום בעולם וכשניגבו את הקקי לילדיהם התנחמו בעובדה שזה בסך הכל פופו ריחני... "
85,הנה הים!!,מילות שיר ילדים נושן,"אחת החוויות המעצבות את ילדי הגבעה משנות ה- 40 ועד שנות ה- 70 היתה הנסיעה המשותפת לים. הכל החל במודעה על לוח המודעות - נוסעים לים!! כל משפחה היתה מקבלת כרטיס עם מספר המשאית ובשעה היעודה כל הקיבוץ היה מתאסף ליד ה'עיגול' ועולה למשאית. הויכוח הנצחי היה 'מי הנהג הטוב ביותר? '. קורט נסע מהר, דולפוס היה בסדר, ברוך נסע לאט ויומבו סיפר בדיחות. בין המשאיות היתה תחרות מי יגיע ראשון והקהל היה מעודד את הנהגים לעקוף במהירות. כאשר נגלה הכחול של הים, פרצו כל הילדים בשירה אדירה - הנה הים! שירה שלא פסקה עד ..הים!","שיר ילדים עממי, גם הלחן",-1,4,2,2016,"אחת החוויות המעצבות את ילדי הגבעה משנות ה- 40 ועד שנות ה- 70 היתה הנסיעה המשותפת לים. הכל החל במודעה על לוח המודעות - נוסעים לים!! כל משפחה היתה מקבלת כרטיס עם מספר המשאית ובשעה היעודה כל הקיבוץ היה מתאסף ליד ה'עיגול' ועולה למשאית. הויכוח הנצחי היה 'מי הנהג הטוב ביותר? '. קורט נסע מהר, דולפוס היה בסדר, ברוך נסע לאט ויומבו סיפר בדיחות. בין המשאיות היתה תחרות מי יגיע ראשון והקהל היה מעודד את הנהגים לעקוף במהירות. כאשר נגלה הכחול של הים, פרצו כל הילדים בשירה אדירה - הנה הים! שירה שלא פסקה עד ..הים!"
