ID,Name,TermTranslation,Background,InventedBy,InventedByMemberID,ObjectID,StatusID,PageHits,BackgroundNoHtml
46,לא מפה,"איש/ה זר/ה שחדר למרחב ג""ב","אמהות רבות נהגו להזהיר את ילדיהם מאנשים ש""הם לא מפה"". חברים נהגו להדגיש כאשר סיפרו על מישהו שהיה בגבעה מכל סיבה שהיא - ש""הוא לא מפה"". גם אם היה איש חשוב ביותר, ההוא ש""הוא לא מפה"" - לא יקבע לנו שום דבר. הקשר לאדמה ובעיקר לאלו שפוסעים עליה היה חזק מכל דבר ולכן חיוני לשמור על עצמאות ההחלטה והמחשבה מפני כל זר ופולש.
חוגים 'יודעי דבר' טוענים שהמצב אליו נקלע המשק הוא תוצאה ישירה לעובדה, שאנשים ש""הם לא מפה"" קיבלו החלטות במקומנו...ועם עובדות קשה להתווכח...",ביטוי עממי שגור,-1,4,2,1917,"אמהות רבות נהגו להזהיר את ילדיהם מאנשים ש""הם לא מפה"". חברים נהגו להדגיש כאשר סיפרו על מישהו שהיה בגבעה מכל סיבה שהיא - ש""הוא לא מפה"". גם אם היה איש חשוב ביותר, ההוא ש""הוא לא מפה"" - לא יקבע לנו שום דבר. הקשר לאדמה ובעיקר לאלו שפוסעים עליה היה חזק מכל דבר ולכן חיוני לשמור על עצמאות ההחלטה והמחשבה מפני כל זר ופולש.
חוגים 'יודעי דבר' טוענים שהמצב אליו נקלע המשק הוא תוצאה ישירה לעובדה, שאנשים ש""הם לא מפה"" קיבלו החלטות במקומנו...ועם עובדות קשה להתווכח..."
47,מחנה,"השטח עליו שוכנת גבעת ברנר, בלי השדות","..היום ראיתי איש אחד ש'הוא לא מפה' (עיין ערך) מסתובב ב'מחנה', נהגו חברים לומר.
מאחר וגילו של המונח הזה כגילו של המשק, סביר להניח שהחלוצים שהמציאו אותו
חשבו שהם הגיעו למחנה, כמו בימי תנועת הנוער באירופה. הטעות שלהם היתה לא קטנה.. למרות ששנים ארוכות שטח הקיבוץ דמה למחנה קיץ. ה'מחנה' הכיל תמיד את כל מבני המגורים המפעלים ומוסדות השירות ועל כן המושג 'מחוץ למחנה' קיבל משנה תוקף. כשהאמא הקיבוצית ביקשה מבנה ""לא לצאת מה'מחנה"", היא ידעה על מה היא מדברת..כמו כל אמא!",ביטוי חלוצי מובהק,-1,4,2,1838,"..היום ראיתי איש אחד ש'הוא לא מפה' (עיין ערך) מסתובב ב'מחנה', נהגו חברים לומר.
מאחר וגילו של המונח הזה כגילו של המשק, סביר להניח שהחלוצים שהמציאו אותו
חשבו שהם הגיעו למחנה, כמו בימי תנועת הנוער באירופה. הטעות שלהם היתה לא קטנה.. למרות ששנים ארוכות שטח הקיבוץ דמה למחנה קיץ. ה'מחנה' הכיל תמיד את כל מבני המגורים המפעלים ומוסדות השירות ועל כן המושג 'מחוץ למחנה' קיבל משנה תוקף. כשהאמא הקיבוצית ביקשה מבנה ""לא לצאת מה'מחנה"", היא ידעה על מה היא מדברת..כמו כל אמא!"
48,נוסע לרחובות,כיסים מציצים,"כשכיסיו של ילד מציצים מתחת למכנסיו הקצרים, אומרים שהוא ""נוסע לרחובות"". נסיון קלוש להסביר את המונח המוזר: קצות הכיסים נראים כמו כרטיס לרחובות...",,-1,4,2,2000,"כשכיסיו של ילד מציצים מתחת למכנסיו הקצרים, אומרים שהוא ""נוסע לרחובות"". נסיון קלוש להסביר את המונח המוזר: קצות הכיסים נראים כמו כרטיס לרחובות..."
49,בגדי בוקר,"בגדים לשעות הבוקר, שאפשר ללכלך","בבית הילדים לא נותר הרבה מקום לבחירה אישית של הלבוש. בבוקר לובשים ""בגדי בוקר"", איתם מתגלגלים בארגז החול ושאר פעילויות, ובערב הולכים לחדר של ההורים בבגדי הערב.
המטפלת: ""היום לובשים בגדי בוקר בערב, כי מחר יום שישי ומקבלים בגדי שבת חדשים"".
את בגדי הבוקר כינו, בצדק מסויים, בגדי בוץ. ילדי הגבעה הכניסו תוכן לבגדים, בדר""כ בצבע חום. עין לא מנוסה היתה לעיתים מתבלבלת בין בגדי הבוקר לערב, על כן רקמו עובדות המחסן על הצווארון מאחור את האות: ע' או ש' לבגדי הערב - שבת, ואת האות: ב' - לבגדי בוקר או בוץ..",עובדות המחסן ובתי הילדים,-1,4,2,2032,"בבית הילדים לא נותר הרבה מקום לבחירה אישית של הלבוש. בבוקר לובשים ""בגדי בוקר"", איתם מתגלגלים בארגז החול ושאר פעילויות, ובערב הולכים לחדר של ההורים בבגדי הערב.
המטפלת: ""היום לובשים בגדי בוקר בערב, כי מחר יום שישי ומקבלים בגדי שבת חדשים"".
את בגדי הבוקר כינו, בצדק מסויים, בגדי בוץ. ילדי הגבעה הכניסו תוכן לבגדים, בדר""כ בצבע חום. עין לא מנוסה היתה לעיתים מתבלבלת בין בגדי הבוקר לערב, על כן רקמו עובדות המחסן על הצווארון מאחור את האות: ע' או ש' לבגדי הערב - שבת, ואת האות: ב' - לבגדי בוקר או בוץ.."
50,להתפרץ לצינור,משחק 'תופסת' בבריכת השחיה,"בבריכת זקס, שעל אף מימדיה הצנועים הצמיחה אלופי שחייה (ארציים), היה צינור גדול ושחור בפינת הבריכה. המתפרצים היו קופצים מן הקיר הנגדי למים, והמגינים היו צריכים לתפוס אותם לפני שיגעו בצינור. את המים בבריכה היו מחליפים פעם בשבוע, ביום שישי. יום חמישי היה איפוא יומם של המתפרצים, המים העכורים נתנו להם מחסה מעולה.
בבריכה החדשה, שנפתחה בראשית שנות ה- 60, לא היה צינור, ולכן שונה המשחק ל""התפרצות לפינה"". הכלור שהוכנס למים הפך אותם לצלולים ואלמנט התיחכום והמהירות החליף את יכולת הצלילה המושכת מתחת למים.",מונח ילדים עממי,-1,4,2,1978,"בבריכת זקס, שעל אף מימדיה הצנועים הצמיחה אלופי שחייה (ארציים), היה צינור גדול ושחור בפינת הבריכה. המתפרצים היו קופצים מן הקיר הנגדי למים, והמגינים היו צריכים לתפוס אותם לפני שיגעו בצינור. את המים בבריכה היו מחליפים פעם בשבוע, ביום שישי. יום חמישי היה איפוא יומם של המתפרצים, המים העכורים נתנו להם מחסה מעולה.
בבריכה החדשה, שנפתחה בראשית שנות ה- 60, לא היה צינור, ולכן שונה המשחק ל""התפרצות לפינה"". הכלור שהוכנס למים הפך אותם לצלולים ואלמנט התיחכום והמהירות החליף את יכולת הצלילה המושכת מתחת למים."
51,סמרטוט רצפה,סחבה לספונג'ה,"ביום חמישי, יום הנקיון, שוטפים את החדר. שופכים מים, עוברים עם סמרטוט ספוג במים, אותם מורידים באמצעות ""מקל גומי"" (מגב) ואחר כך מנגבים עם סמרטוט רצפה, הפעם סחוט ויבש.
לסמרטוט הרצפה נוספו שימושים עם השנים, כמו לחסום את החריץ שמתחת לדלת נגד נמלים וג'וקים, לשמש 'מבודד' בלוחמת האב""כ ועוד.
בארצות לא כל כך מפותחות, כמו ארצות הברית, המונח וגם הסמרטוט אינם מוכרים, מה שהופך אותם למתנה רצויה כשנוסעים לבקר חברים או בני משפחה השוהים שם.",,-1,4,2,1957,"ביום חמישי, יום הנקיון, שוטפים את החדר. שופכים מים, עוברים עם סמרטוט ספוג במים, אותם מורידים באמצעות ""מקל גומי"" (מגב) ואחר כך מנגבים עם סמרטוט רצפה, הפעם סחוט ויבש.
לסמרטוט הרצפה נוספו שימושים עם השנים, כמו לחסום את החריץ שמתחת לדלת נגד נמלים וג'וקים, לשמש 'מבודד' בלוחמת האב""כ ועוד.
בארצות לא כל כך מפותחות, כמו ארצות הברית, המונח וגם הסמרטוט אינם מוכרים, מה שהופך אותם למתנה רצויה כשנוסעים לבקר חברים או בני משפחה השוהים שם."
52,קופסא,"מצוף גלילי, קופסת פח ללימוד שחיה","כל ילדי הגנים למדו שחייה בבריכת זקס. הבריכה היתה עמוקה ולמרבית הילדים היתה בעיית ציפה.  ב'רימון' מילאו באותם ימים רכז ומיץ בקופסאות פח והנה .. נמצא הפתרון. הפחח של רימון הלחים לולאות לקופסא, ורצועת בד חיברה את הינוקות ל'אזניים' ולא מעט אלופי שחייה יצאו לדרך (לאחר כמובן שהשתחררו מהקופסא).לקופסא היו גם חסרונות : בקפיצה למים היתה קופסת הפח חובטת בראש הפעוט, לפעמים הרצועות היו נפתחות וה'שחיין' הצעיר היה שוקע לפתע , לעיתים הקשר מאחור היה מסתבך ו'פרח השחיה' היה מגיע לחדר ההורים עם הקופסא על גבו.. ",כנראה בנימין זק,-1,4,2,1861,"כל ילדי הגנים למדו שחייה בבריכת זקס. הבריכה היתה עמוקה ולמרבית הילדים היתה בעיית ציפה.  ב'רימון' מילאו באותם ימים רכז ומיץ בקופסאות פח והנה .. נמצא הפתרון. הפחח של רימון הלחים לולאות לקופסא, ורצועת בד חיברה את הינוקות ל'אזניים' ולא מעט אלופי שחייה יצאו לדרך (לאחר כמובן שהשתחררו מהקופסא).לקופסא היו גם חסרונות : בקפיצה למים היתה קופסת הפח חובטת בראש הפעוט, לפעמים הרצועות היו נפתחות וה'שחיין' הצעיר היה שוקע לפתע , לעיתים הקשר מאחור היה מסתבך ו'פרח השחיה' היה מגיע לחדר ההורים עם הקופסא על גבו.. "
53,חדר,דירת המגורים הקיבוצית,"בהתחלה היה אוהל ובו גרו החלוצים, אחר כך בנו צריף ולבסוף גם בית של ממש, מבלוקים ומלט. גודל הדירה הראשונה, לפי תקן הקיבוץ המאוחד היה 12 מ""ר ורוב המשפחות הסתדרו לא רע. כמובן שהמרפסות הורחבו וחריגות ה'בניה' פרחו. עם השנים הוגדל ה'חדר' ל- 32 מ""ר והגיע עד 80 מ""ר - ממש וילה. דבר אחד לא השתנה. ילדי וחברי הקיבוץ קראו לביתם - חדר. ""עכשו אתה הולך לחדר"" אמרה המטפלת לילד שנשאר לשחק בגן או בכיתה..
""אני רוצה לישון בחדר"", ייבב פעוט שלא נהנה במיוחד בבית הכולל. ""בחדר שלי עם אשתי..אין לו בושה"" נהם הבעל המקורנן...",,-1,4,2,1863,"בהתחלה היה אוהל ובו גרו החלוצים, אחר כך בנו צריף ולבסוף גם בית של ממש, מבלוקים ומלט. גודל הדירה הראשונה, לפי תקן הקיבוץ המאוחד היה 12 מ""ר ורוב המשפחות הסתדרו לא רע. כמובן שהמרפסות הורחבו וחריגות ה'בניה' פרחו. עם השנים הוגדל ה'חדר' ל- 32 מ""ר והגיע עד 80 מ""ר - ממש וילה. דבר אחד לא השתנה. ילדי וחברי הקיבוץ קראו לביתם - חדר. ""עכשו אתה הולך לחדר"" אמרה המטפלת לילד שנשאר לשחק בגן או בכיתה..
""אני רוצה לישון בחדר"", ייבב פעוט שלא נהנה במיוחד בבית הכולל. ""בחדר שלי עם אשתי..אין לו בושה"" נהם הבעל המקורנן..."
54,בית כולל,בית המכיל כיתה חדר אוכל וחדרי מגורים,"כאשר הגיעו ילדי הגבעה הראשונים לגיל בית הספר, חיפשו פרנסי החינוך פתרון עבורם.
איך לשמור על המסגרת החברתית שבה ""משפחת הילד"" היא בני הכיתה שלו והמטפלות הם ה'הורים' שלו - ואז הומצא 'הבית הכולל'. המבנה הכיל כיתת לימוד, חדר אוכל וחדרי שינה והילדים בילו 20 שעות ביממה בבית הכולל (בין ארבע אחה""צ לשמונה בערב הלכו ל'חדר').
על גבעת בית ספר ניצבו 5 בתים כוללים ובהם גרו ילדי כיתות א' עד ו'. מאחר וזה היה 'הבית' שלנו הרגשנו בו כ'בעלי בית' וכל זר או מבוגר שנכנס ל'טריטוריה' (גם בתפקיד) זכה ליחס הולם..
",לא ידוע,-1,4,2,2006,"כאשר הגיעו ילדי הגבעה הראשונים לגיל בית הספר, חיפשו פרנסי החינוך פתרון עבורם.
איך לשמור על המסגרת החברתית שבה ""משפחת הילד"" היא בני הכיתה שלו והמטפלות הם ה'הורים' שלו - ואז הומצא 'הבית הכולל'. המבנה הכיל כיתת לימוד, חדר אוכל וחדרי שינה והילדים בילו 20 שעות ביממה בבית הכולל (בין ארבע אחה""צ לשמונה בערב הלכו ל'חדר').
על גבעת בית ספר ניצבו 5 בתים כוללים ובהם גרו ילדי כיתות א' עד ו'. מאחר וזה היה 'הבית' שלנו הרגשנו בו כ'בעלי בית' וכל זר או מבוגר שנכנס ל'טריטוריה' (גם בתפקיד) זכה ליחס הולם..
"
55,שורות,שכונת המגורים של כיתות ו'- ח',"החינוך המשותף דאג להתפתחות אבולוציונית חברתית ואישית של חניכיו ועל כן לאחר החמישיות, גן הילדים והבית הכולל הגיעו ילדי הגבעה ל'שורות'. בגיל 11 או 12 כאשר סימני ההתבגרות כבר ניתנים לזיהוי מרחוק זכו ה'נערים/ות' ב'חדר' משלהם שבו לכל אחד מיטה וארון קטן, מקלחת ושירותים בקצה המסדרון (הפתוח). בכל בית היו 4 חדרים ובכל חדר 4 ילדים כך שבשעות הלחץ כאשר פעמון בית הספר כבר צילצל, התור לשירותים היה כבר מפוצץ..
מרכז הפעילות החברתית היה 'חדר העבודה' של המטפלת ולמה שנעשה שם יש קשר מועט ביותר לחינוך..משותף...",,-1,4,2,1994,"החינוך המשותף דאג להתפתחות אבולוציונית חברתית ואישית של חניכיו ועל כן לאחר החמישיות, גן הילדים והבית הכולל הגיעו ילדי הגבעה ל'שורות'. בגיל 11 או 12 כאשר סימני ההתבגרות כבר ניתנים לזיהוי מרחוק זכו ה'נערים/ות' ב'חדר' משלהם שבו לכל אחד מיטה וארון קטן, מקלחת ושירותים בקצה המסדרון (הפתוח). בכל בית היו 4 חדרים ובכל חדר 4 ילדים כך שבשעות הלחץ כאשר פעמון בית הספר כבר צילצל, התור לשירותים היה כבר מפוצץ..
מרכז הפעילות החברתית היה 'חדר העבודה' של המטפלת ולמה שנעשה שם יש קשר מועט ביותר לחינוך..משותף..."
56,חטיבה,"ארגון הגג של בני הקיבוץ מכיתות ז' - י""ב","בשנת 1954 ביוזמת מספר בני י""ב לפני גיוס ברחבי הארץ הוחלט להקים את חטיבת בני הקיבוץ המאוחד, מעין ארגון גג לנוער בכיתות ז'-י""ב.  בג""ב הגדולה בקיבוצים הוחלט לחלק את החטיבה ל- 4 מחנות: אמיר אלון ארז וניצן. בני י""ב דאז, הכיתה של זאבי רייס ניהלו את החטיבה. הפעילות כללה הדרכה לכיתות הצעירות, טיולים, ערבי הווי, חגים, בטאון 'חבריא' וכיו""ב. עם השנים החטיבה היתה לכוח חשוב בקיבוץ, ביצעה קטיף תחרותי בפרדס וגיוסים במשק, קיימה את 'יום עודד' ואליפויות ספורט ודאגה מדי שנה ל'השביע' את בני כתה ז' בצורה 'מקורית'...",לא ידוע,-1,4,2,1988,"בשנת 1954 ביוזמת מספר בני י""ב לפני גיוס ברחבי הארץ הוחלט להקים את חטיבת בני הקיבוץ המאוחד, מעין ארגון גג לנוער בכיתות ז'-י""ב.  בג""ב הגדולה בקיבוצים הוחלט לחלק את החטיבה ל- 4 מחנות: אמיר אלון ארז וניצן. בני י""ב דאז, הכיתה של זאבי רייס ניהלו את החטיבה. הפעילות כללה הדרכה לכיתות הצעירות, טיולים, ערבי הווי, חגים, בטאון 'חבריא' וכיו""ב. עם השנים החטיבה היתה לכוח חשוב בקיבוץ, ביצעה קטיף תחרותי בפרדס וגיוסים במשק, קיימה את 'יום עודד' ואליפויות ספורט ודאגה מדי שנה ל'השביע' את בני כתה ז' בצורה 'מקורית'..."
57,קטיף התפוזים,תחרות סוציאליסטית - מי קוטף הכי הרבה..,"בשנות ה- 60, לקחה החטיבה את קטיף ההדרים לידיה. מדי צהריים יצאנו בטרקטור ועגלה לשטח הפרדס המיועד לקטיף. לכל מחנה התלווה חבר שדאג לסולמות לתרמילים ולמקטפות אך בעיקר השגיח שהנוער: א. קוטף ולא תולש את הפרי ב. ממלא מיכלים עד הסוף. ג. לא יוצא למשימות 'כיסוח' בשטח. לכל חלקה היתה 'נורמה' שבה נקבעו מספרי המיכלים לקוטף/ת ובסוף כל יום נספרו המיכלים ונקבעה התוצאה. כמובן שהיו חלקות 'טובות' עם עצים נמוכים והרבה פרי והיו גם 'אלוני ממרא'.. בערב היו מעדכנים את הגרף שעל לוח המודעות בחדר האוכל, ומתחילים להתווכח..",,-1,4,2,1838,"בשנות ה- 60, לקחה החטיבה את קטיף ההדרים לידיה. מדי צהריים יצאנו בטרקטור ועגלה לשטח הפרדס המיועד לקטיף. לכל מחנה התלווה חבר שדאג לסולמות לתרמילים ולמקטפות אך בעיקר השגיח שהנוער: א. קוטף ולא תולש את הפרי ב. ממלא מיכלים עד הסוף. ג. לא יוצא למשימות 'כיסוח' בשטח. לכל חלקה היתה 'נורמה' שבה נקבעו מספרי המיכלים לקוטף/ת ובסוף כל יום נספרו המיכלים ונקבעה התוצאה. כמובן שהיו חלקות 'טובות' עם עצים נמוכים והרבה פרי והיו גם 'אלוני ממרא'.. בערב היו מעדכנים את הגרף שעל לוח המודעות בחדר האוכל, ומתחילים להתווכח.."
58,סקווש,"מיץ מרוכז, תרכיז מתוצרת 'רימון'","'סקווש' באנגלית זה למעוך, זו דלעת מהגינה, בעולם הרחב זה כינוי למשחק טניס מול קיר, אבל בגבעת ברנר - סקווש זה מיץ. לא כל מיץ וכמובן שלא מכל תוצרת אנונימית. הסקווש הוא מיץ מרוכז מתוצרת בית החרושת 'רימון', עדיף לימון או פטל אך אפשר גם תפוזים אשכולית או מנדרינות. את הסקווש מכרו ""בחוץ"" בבקבוקים אך החברים העדיפו לקחתו בדמינג'אנות, עוד מושג שכבודו מונח ב'ארון הספרים הברנרי'. הסקווש היה מרכיב בלתי נפרד מהווי טיולי החטיבה, 'דייר' קבוע בשולחנות חגי המשק וכמובן חלק אינטגרלי ממקררי 'סיביר' עליהם השלום. ",מושג מייד אין 'רימון'..כנראה מתקופת הבריטים,-1,4,2,2060,"'סקווש' באנגלית זה למעוך, זו דלעת מהגינה, בעולם הרחב זה כינוי למשחק טניס מול קיר, אבל בגבעת ברנר - סקווש זה מיץ. לא כל מיץ וכמובן שלא מכל תוצרת אנונימית. הסקווש הוא מיץ מרוכז מתוצרת בית החרושת 'רימון', עדיף לימון או פטל אך אפשר גם תפוזים אשכולית או מנדרינות. את הסקווש מכרו ""בחוץ"" בבקבוקים אך החברים העדיפו לקחתו בדמינג'אנות, עוד מושג שכבודו מונח ב'ארון הספרים הברנרי'. הסקווש היה מרכיב בלתי נפרד מהווי טיולי החטיבה, 'דייר' קבוע בשולחנות חגי המשק וכמובן חלק אינטגרלי ממקררי 'סיביר' עליהם השלום. "
59,דמינג'אנה,"כלי קיבול מפלסטיק לנוזלים, עדיף ממותקים","ביח""ר 'רימון' החל את דרכו התעשייתית כספק ריבות, שימורים ומיצים לצבא הבריטי שלחם במדבר המערבי בגרמנים ומירר ליהודים את החיים בפלסטינה. לאחר שהוקמה המדינה חזרו הביתה חיילי הוד מלכותו, לא לפני שהשאירו כאן מספר מושגים שאחד מהם זה כלי הפלסטיק הקרוי - דמינג'אנה. בדמינג'אנה מילאו מיצים מכל הסוגים ושלחו אותם מעבר לכביש ואף מעבר לים, בדמינג'אנה לקחו מים לשדה, לפיקניק ולטיולים, אך מעל לכל שימשה הדמינג'אנה (יחד עם הדופיה והאגס) כקוד זיהוי בין בני ג""ב בארץ ובעולם...או שידעת מה זה דמינג'אנה או שאתה 'לא מפה'.",מושג איטלקי שהושרש בימי המנדט,-1,4,2,2102,"ביח""ר 'רימון' החל את דרכו התעשייתית כספק ריבות, שימורים ומיצים לצבא הבריטי שלחם במדבר המערבי בגרמנים ומירר ליהודים את החיים בפלסטינה. לאחר שהוקמה המדינה חזרו הביתה חיילי הוד מלכותו, לא לפני שהשאירו כאן מספר מושגים שאחד מהם זה כלי הפלסטיק הקרוי - דמינג'אנה. בדמינג'אנה מילאו מיצים מכל הסוגים ושלחו אותם מעבר לכביש ואף מעבר לים, בדמינג'אנה לקחו מים לשדה, לפיקניק ולטיולים, אך מעל לכל שימשה הדמינג'אנה (יחד עם הדופיה והאגס) כקוד זיהוי בין בני ג""ב בארץ ובעולם...או שידעת מה זה דמינג'אנה או שאתה 'לא מפה'."
