ID,Name,TermTranslation,Background,InventedBy,InventedByMemberID,ObjectID,StatusID,PageHits,BackgroundNoHtml
8,ה'נקודה',המקום אליו עלו הראשונים,"הויכוח על מיקום 'הנקודה' ניטש כמעט 75 שנה. אמנם 'הנקודה' היתה השם הלא רשמי של מחנה פלוגת עין חרוד שעלתה על הקרקע מרחובות - אבל האם מרכז 'הנקודה' הוא 'הבית הגדול' או המחנה הזמני בעמק 'עור פאטמה', היכן שנמצא הלול היום. לשונאים וגיאוגרפים מכל הדורות ניסו את כוחם בהגדרת המושג ה'מתמטי' הזה, ועד היום לא נמצא מענה מוסכם. מבקרי האתר מוזמנים להציע פתרון!","לא ידוע, בינתיים",-1,4,2,1853,"הויכוח על מיקום 'הנקודה' ניטש כמעט 75 שנה. אמנם 'הנקודה' היתה השם הלא רשמי של מחנה פלוגת עין חרוד שעלתה על הקרקע מרחובות - אבל האם מרכז 'הנקודה' הוא 'הבית הגדול' או המחנה הזמני בעמק 'עור פאטמה', היכן שנמצא הלול היום. לשונאים וגיאוגרפים מכל הדורות ניסו את כוחם בהגדרת המושג ה'מתמטי' הזה, ועד היום לא נמצא מענה מוסכם. מבקרי האתר מוזמנים להציע פתרון!"
10,פרימוס ופתילייה,כלי חימום ו/או שותפים 'סמויים' לאוהל,"
בימים כתיקונם (החל מאמצע שנות ה- 30) אלו כלים נפוצים להבערת אש לשימוש ביתי.
בראשית ימי ג""ב לכל זוג באוהל צורף דייר נוסף (פרימוס) או זוג דיירים (פתילייה).
למשל, יעקב ואנני היו ה'פתילייה' של אחיו הבכור יחיאל ורעייתו מילכה.
",,-1,4,2,2809,"
בימים כתיקונם (החל מאמצע שנות ה- 30) אלו כלים נפוצים להבערת אש לשימוש ביתי.
בראשית ימי ג""ב לכל זוג באוהל צורף דייר נוסף (פרימוס) או זוג דיירים (פתילייה).
למשל, יעקב ואנני היו ה'פתילייה' של אחיו הבכור יחיאל ורעייתו מילכה.
"
11,מצרינה,אולם ליל הסדר. אולם הספורט הביתי של ג,"קצת לפני האביב חיפשו פרנסי ישוב מקום ראוי וגדול לעריכת סדר פסח. המקום נבחר ומסגרי הקיבוץ אילתרו מבנה על קונסטרוקציות ברזל שעל הכנתו לפסח שקדו יומם וליל.
באחת מארוחות העשר, טרם חנוכת המקום חיפשו שם למבנה. הויכוח התלהט ואחד הציע:
אולם ספורט זה ארינה, אבל זה בשביל פסח, קפץ שני והוסיף: בפסח אוכלים מצות אז שיהיה מצרנה, וכך בהפסקת עשר אחת נולד השם.
",הומצא כנראה במסגריה,-1,4,2,2252,"קצת לפני האביב חיפשו פרנסי ישוב מקום ראוי וגדול לעריכת סדר פסח. המקום נבחר ומסגרי הקיבוץ אילתרו מבנה על קונסטרוקציות ברזל שעל הכנתו לפסח שקדו יומם וליל.
באחת מארוחות העשר, טרם חנוכת המקום חיפשו שם למבנה. הויכוח התלהט ואחד הציע:
אולם ספורט זה ארינה, אבל זה בשביל פסח, קפץ שני והוסיף: בפסח אוכלים מצות אז שיהיה מצרנה, וכך בהפסקת עשר אחת נולד השם.
"
12,הסימטה,דרך - כביש הכניסה לגבעת ברנר,"מאז ומעולם היתה ה'סימטה' הכניסה הראשית לג""ב מקור לא אכזב לבעיות תעבורה. בקיץ אבנים ובחורף בוץ. הוחלט לשכנע את הנציב העליון שחייבים לסלול כביש. הזמינו אותו ביום חורף, ובאותו הבוקר יצאו עגלות עמוסות חביות מים ש'הישקו' את הדרך. כשהפמליה שלו שקעה בבוץ, נקשר אליה הסוס (שחיכה בפינה) ואחר כבוד הועלו לגבעה. הנציב שוכנע וה'סימטה' היתה לכביש. אגדות (אנסים) ואמונות תפלות נקשרו לרוחות ולסכנות שסבבו את ה'סימטה' אך הקורבן היחיד שנפגע ב'סימטה' היה פוטשקה שנורה באופן מסתורי ברגלו במלחמת השחרור..
",עממי,-1,4,2,1949,"מאז ומעולם היתה ה'סימטה' הכניסה הראשית לג""ב מקור לא אכזב לבעיות תעבורה. בקיץ אבנים ובחורף בוץ. הוחלט לשכנע את הנציב העליון שחייבים לסלול כביש. הזמינו אותו ביום חורף, ובאותו הבוקר יצאו עגלות עמוסות חביות מים ש'הישקו' את הדרך. כשהפמליה שלו שקעה בבוץ, נקשר אליה הסוס (שחיכה בפינה) ואחר כבוד הועלו לגבעה. הנציב שוכנע וה'סימטה' היתה לכביש. אגדות (אנסים) ואמונות תפלות נקשרו לרוחות ולסכנות שסבבו את ה'סימטה' אך הקורבן היחיד שנפגע ב'סימטה' היה פוטשקה שנורה באופן מסתורי ברגלו במלחמת השחרור..
"
13,הבית הגדול,בית סרני,"הבית הראשון שנבנה על פסגת הגבעה במשך שנה( 1930) שימש לתפקידים רבים: מגורים, מרפאה, חדרי חולים, דואר, משרד המזכירות. ב- 1947 שופץ והותאם כבית תרבות, צורף אליו אולם תיאטרון והמבנה כולו הוסב על שמו של חיים אנצו סרני שיצא כצנחן בשליחות לאירופה, נתפס והוצא להורג במחנה הריכוז דכאו.  הבית שלפני שינויו היה מוקף אוהלים נעשה לסמל הישוב. ממגדלו אותתו תשדורות בטחוניות לישובי הסביבה. בשל צבעו הלבן הנראה למרחקים קראו לו הערבים 'קלעת אל אביאד' - ""המבצר הלבן"", ובאמת היה בית בטחון בשביל הישוב הקטן.
",עממי,-1,4,2,1995,"הבית הראשון שנבנה על פסגת הגבעה במשך שנה( 1930) שימש לתפקידים רבים: מגורים, מרפאה, חדרי חולים, דואר, משרד המזכירות. ב- 1947 שופץ והותאם כבית תרבות, צורף אליו אולם תיאטרון והמבנה כולו הוסב על שמו של חיים אנצו סרני שיצא כצנחן בשליחות לאירופה, נתפס והוצא להורג במחנה הריכוז דכאו.  הבית שלפני שינויו היה מוקף אוהלים נעשה לסמל הישוב. ממגדלו אותתו תשדורות בטחוניות לישובי הסביבה. בשל צבעו הלבן הנראה למרחקים קראו לו הערבים 'קלעת אל אביאד' - ""המבצר הלבן"", ובאמת היה בית בטחון בשביל הישוב הקטן.
"
14,קיר המוות,     השכונה הראשונה בגבעה,"בשנת 1934 אוכלוסיית המקום מנתה 200 נפש בקירוב. הפלוגה השתדלה להתבסס כלכלית ללא השקעות נוספות. נקנו עוד אוהלים, סחבו בלוקים מהסביבה והקימו אחר שעות העבודה את ""שיכון הותיקים"" המשוכלל של התקופה.  באותה עת היתה ברחובות הופעת להטוטנים לאופנועים שטיפסו על כותל בשם ""קיר המוות"". כינוי זה דבק משום מה בשיכון זה עד סוף ימיו.
הקירות נערמו מבלוקים שלא חוברו בטיט, הרצפה הודקה בחמרה לחה, כפי שהדבר נעשה גם באוהלים. הגג הורכב בחלקו מפחים ישנים ובחלקו משקים מרוחים בסיד. ",עממי,-1,4,2,2268,"בשנת 1934 אוכלוסיית המקום מנתה 200 נפש בקירוב. הפלוגה השתדלה להתבסס כלכלית ללא השקעות נוספות. נקנו עוד אוהלים, סחבו בלוקים מהסביבה והקימו אחר שעות העבודה את ""שיכון הותיקים"" המשוכלל של התקופה.  באותה עת היתה ברחובות הופעת להטוטנים לאופנועים שטיפסו על כותל בשם ""קיר המוות"". כינוי זה דבק משום מה בשיכון זה עד סוף ימיו.
הקירות נערמו מבלוקים שלא חוברו בטיט, הרצפה הודקה בחמרה לחה, כפי שהדבר נעשה גם באוהלים. הגג הורכב בחלקו מפחים ישנים ובחלקו משקים מרוחים בסיד. "
15,בית סוכנות,בתי החומה א' - י',"את 'בתי הסוכנות' יחד עם בנין המקלחת הגדולה ובית השימוש שהוקמו כשירותים סניטריים ציבוריים ליד בתי המגורים החלו לבנות בשנת 1934 וסיימו ב- 1938. תכניות הבתים נתקבלו כתנאי לקבלת הלוואות מן הסוכנות (ל- 30 שנה ללא ריבית). בתים דומים לאלו אפשר למצוא בכל משק ותיק. בית א'(הארכיון) נבנה לפי דוגמת 'הבית הגדול' עם מגדל המשמש בית מדרגות וגג לבילוי הדיירים. הוא עלה 612 לא""י, סכום גבוה למדי. לפיכך ויתרו על המגדל ביתר 9 הבתים.",עממי,-1,4,2,1925,"את 'בתי הסוכנות' יחד עם בנין המקלחת הגדולה ובית השימוש שהוקמו כשירותים סניטריים ציבוריים ליד בתי המגורים החלו לבנות בשנת 1934 וסיימו ב- 1938. תכניות הבתים נתקבלו כתנאי לקבלת הלוואות מן הסוכנות (ל- 30 שנה ללא ריבית). בתים דומים לאלו אפשר למצוא בכל משק ותיק. בית א'(הארכיון) נבנה לפי דוגמת 'הבית הגדול' עם מגדל המשמש בית מדרגות וגג לבילוי הדיירים. הוא עלה 612 לא""י, סכום גבוה למדי. לפיכך ויתרו על המגדל ביתר 9 הבתים."
16,המחסן המרכזי,מבנה השירותים ליד העיגול,"נבנה ב- 1936 ושמר באופן כללי על צורתו המקורית. סיגריות ומצרכים אישיים חולקו בחדר האוכל. במחסן זה נערכה גם ועידת הקיבוץ בשנת 1942 בה סופר לראשונה על זוועות השואה. במחסן שוכנו לצד האורווה והזגג, אריך איטל ומשה גוטליב.מבנה זה תוכנן ע""י פרופ. היברשיים.
",,-1,4,2,1762,"נבנה ב- 1936 ושמר באופן כללי על צורתו המקורית. סיגריות ומצרכים אישיים חולקו בחדר האוכל. במחסן זה נערכה גם ועידת הקיבוץ בשנת 1942 בה סופר לראשונה על זוועות השואה. במחסן שוכנו לצד האורווה והזגג, אריך איטל ומשה גוטליב.מבנה זה תוכנן ע""י פרופ. היברשיים.
"
17,ה'מליונרים',שכונת יוקרה לותיקים,"ב- 1938 התחילו דיונים על הקמת שכונה חדשה, הפעם בתשומת לב רבה לרמת הדיור. הכינוי ""שכונת המליונרים"" בא להראות על כך, ועדיין קרויה השכונה בשם זה למרות שועדת שמות מיוחדת קבעה לה שם אחר, 'חירות' ע""ש קבוץ ההכשרה של ראשוני ג""ב. עד 1941 הוקמו שם 18 צריפים ובית שימוש ציבורי. תוך 8 שנים נוספו עוד 12 בתים בנויים. שטח הדירה התקנית נקבע ע""י ועדת התכנית של הקיבוץ המאוחד והיה 12 מ""ר...אין פלא שמרפסות פרחו באוויר והיו חלק בלתי נפרד מה'חדר'.",כינוי עממי,-1,4,2,1997,"ב- 1938 התחילו דיונים על הקמת שכונה חדשה, הפעם בתשומת לב רבה לרמת הדיור. הכינוי ""שכונת המליונרים"" בא להראות על כך, ועדיין קרויה השכונה בשם זה למרות שועדת שמות מיוחדת קבעה לה שם אחר, 'חירות' ע""ש קבוץ ההכשרה של ראשוני ג""ב. עד 1941 הוקמו שם 18 צריפים ובית שימוש ציבורי. תוך 8 שנים נוספו עוד 12 בתים בנויים. שטח הדירה התקנית נקבע ע""י ועדת התכנית של הקיבוץ המאוחד והיה 12 מ""ר...אין פלא שמרפסות פרחו באוויר והיו חלק בלתי נפרד מה'חדר'."
18,העיגול,הכיכר בכניסה למשק," בכניסה למשק היה ספסל אליו הועבר עץ פיקוס שנשתרש היטב באדמה. סביבו יצקו הבנאים כיכר קטנה והוצב ספסל בטון. ה'עיגול' שימש מאז את הטרמפיסטים (ואת משחקי הילדים). אחד היושבים הקבועים ב'עיגול' היה אורי גאופ בנעליו ההולנדיות שהיה  מקדם בברכה כל אורח ובצביטה בלחי, כל ילד.
",עממי,-1,4,2,2017," בכניסה למשק היה ספסל אליו הועבר עץ פיקוס שנשתרש היטב באדמה. סביבו יצקו הבנאים כיכר קטנה והוצב ספסל בטון. ה'עיגול' שימש מאז את הטרמפיסטים (ואת משחקי הילדים). אחד היושבים הקבועים ב'עיגול' היה אורי גאופ בנעליו ההולנדיות שהיה  מקדם בברכה כל אורח ובצביטה בלחי, כל ילד.
"
19,סולטנה,הפרה הראשונה בגבעת ברנר,"לפרה הראשונה בג""ב קראו 'סולטנה', פרה ביירותית אדומה שהמליטה עגלה (חומה?) בשם 'עלייה' שצאצאיה (דור 18)חיים ברפת של היום. קצת 'הסטוריה' על הרפת: 
את 5 הפרות הראשונות של ג""ב קנה עבורם סורקין מעין חרוד.  
הרפת שכנה בצריף משותף עם הנגריה והאורווה. כשנולד העגל הראשון לא נמצא לו מקום ועקיבא נכנס למזכירות וקשר אותו לרגל של השולחן, וכך נמצא לו בית..
",,-1,4,2,2051,"לפרה הראשונה בג""ב קראו 'סולטנה', פרה ביירותית אדומה שהמליטה עגלה (חומה?) בשם 'עלייה' שצאצאיה (דור 18)חיים ברפת של היום. קצת 'הסטוריה' על הרפת: 
את 5 הפרות הראשונות של ג""ב קנה עבורם סורקין מעין חרוד.  
הרפת שכנה בצריף משותף עם הנגריה והאורווה. כשנולד העגל הראשון לא נמצא לו מקום ועקיבא נכנס למזכירות וקשר אותו לרגל של השולחן, וכך נמצא לו בית..
"
20,מקל גומי,"מגב, אביזר חיוני לשטיפת ה'חדר'","מקל הגומי היה אביזר חובה בכל בית ילדים ו'חדר' קיבוצי תקני. ילדים שגילו שליטה טובה במטאטא קיבלו לידיהם את מקל הגומי ששימש בשלב ראשון לשטיפה עם סמרטוט רטוב, אחר באה הורדת המים ולסיום הולבש סמרטוט יבש על המקל וכך כמעט הושלמה מלאכת השטיפה. מה שנותר היה להוריד כסאות בכיתה ונעלי בית ב'חדר' לרצפה - לאחר שנעשה וידוא רצפה יבשה..",לא ידוע,-1,4,2,1961,"מקל הגומי היה אביזר חובה בכל בית ילדים ו'חדר' קיבוצי תקני. ילדים שגילו שליטה טובה במטאטא קיבלו לידיהם את מקל הגומי ששימש בשלב ראשון לשטיפה עם סמרטוט רטוב, אחר באה הורדת המים ולסיום הולבש סמרטוט יבש על המקל וכך כמעט הושלמה מלאכת השטיפה. מה שנותר היה להוריד כסאות בכיתה ונעלי בית ב'חדר' לרצפה - לאחר שנעשה וידוא רצפה יבשה.."
22,נקיון יסודי,נקיון יסודי,"כל יום שישי בבתי הילדים היו מנקים ב'אופן יסודי'. הנקיון כלל: הרמת מזרונים, הזזת מיטות וניקוי פאנלים, נקוי רשתות החלונות במברשת, אדני החלונות בסמרטוט רטוב וכמובן שטיפה יסודית וניגוב ב'יבש'. המהדרין גם ציחצחו נעליים בחורף וסנדלים בקיץ.",,-1,4,2,1878,"כל יום שישי בבתי הילדים היו מנקים ב'אופן יסודי'. הנקיון כלל: הרמת מזרונים, הזזת מיטות וניקוי פאנלים, נקוי רשתות החלונות במברשת, אדני החלונות בסמרטוט רטוב וכמובן שטיפה יסודית וניגוב ב'יבש'. המהדרין גם ציחצחו נעליים בחורף וסנדלים בקיץ."
23,שמן דגים,"שמן דגים או ""די.די.טי. לשתיה'...","בשנות ה- 50 וה- 60 גרסו יודעי דבר רפואי שמאד בריא לילד הגדל לשתות מדי יום שמן דגים. הטעם הנורא לא היווה עילה מספקת להשתמטות מאותה מצווה בריאותית. דורות של ילדים חמקו או ניסו להתחמק מה'תור' שעמד לפני הגננת/ מטפלת. כל אחד בתורו פתח 'פה גדול' אליו רוקנה כפית גדושה בנוזל השמנוני והבריא..הגננות הותיקות ידעו להכניס את השמן ישר לגרון, הפחות מנוסות שמו אותו בפה ומשם הדרך לגינה או לכיור היתה קצרה..","יבל""ק",-1,4,2,2146,"בשנות ה- 50 וה- 60 גרסו יודעי דבר רפואי שמאד בריא לילד הגדל לשתות מדי יום שמן דגים. הטעם הנורא לא היווה עילה מספקת להשתמטות מאותה מצווה בריאותית. דורות של ילדים חמקו או ניסו להתחמק מה'תור' שעמד לפני הגננת/ מטפלת. כל אחד בתורו פתח 'פה גדול' אליו רוקנה כפית גדושה בנוזל השמנוני והבריא..הגננות הותיקות ידעו להכניס את השמן ישר לגרון, הפחות מנוסות שמו אותו בפה ומשם הדרך לגינה או לכיור היתה קצרה.."
24,סליפ,בגד ים תוצרת בית,"הסליפ הוא בגד ים מבד לבנים אותו תפרו במתפרת הקיבוץ. הסליפ נסגר על ידי חוט מהצד ויחודו - בפס צבעוני החוצה אותו לגובה. 2 תכונות בולטות יש לסליפ - בקפיצת ראש טובה הוא בדרך כלל מחליק עד הברכיים ושיושבים על הקיר או הדשא - הכל בחוץ..
למרות נחיתות תכונותיו של הסליפ הגיעו שחייני גבעת ברנר איתו להישגים מרשימים בזירה הארצית,והחזיקו בשיאי שחיה רבים. 
הישגו הבולט ביותר של סליפ היה בהגעתו ההיסטורית של יצחק לוריא לאולימפיאדת רומא 1960.
לצערן של תופרות הגבעה, הוא החליף את הסליפ ב'ספידו', ולכן סיים במקום 48.",עממי,-1,4,2,2076,"הסליפ הוא בגד ים מבד לבנים אותו תפרו במתפרת הקיבוץ. הסליפ נסגר על ידי חוט מהצד ויחודו - בפס צבעוני החוצה אותו לגובה. 2 תכונות בולטות יש לסליפ - בקפיצת ראש טובה הוא בדרך כלל מחליק עד הברכיים ושיושבים על הקיר או הדשא - הכל בחוץ..
למרות נחיתות תכונותיו של הסליפ הגיעו שחייני גבעת ברנר איתו להישגים מרשימים בזירה הארצית,והחזיקו בשיאי שחיה רבים. 
הישגו הבולט ביותר של סליפ היה בהגעתו ההיסטורית של יצחק לוריא לאולימפיאדת רומא 1960.
לצערן של תופרות הגבעה, הוא החליף את הסליפ ב'ספידו', ולכן סיים במקום 48."
25,החמור של רובניו,חמור עבודה עיקש להובלות קטנות ב'מחנה',"חמור קטן (יש אומרים בכלל אתון) ועיקש שיחד עם ראובן פצ'נובסקי (פדני) שכינויו 'רובניו' (עם אף סתום) עשה הובלות קטנות בדרכי המשק, בעיקר אוכל למטבח הורים. את מרבית הזמן בילו השניים בשכנוע הדדי ובשאלה: ""מי בכלל צריך אותנו? ולכן למה בכלל ללכת?"" (מספר 'עדי ראיה' מוכנים להשבע שראו את רובניו מחליף את החמור). המונח הנ""ל שימש בשיח ה'ברנרי' כמטאפורה לשתי סוגיות: האחת &#8211; זה נושא כה פעוט, אפילו החמור של רובניו יכול לעשותו. השניה &#8211; החוכמה שהפגנת כה פשוטה, אפילו חמורו של רובניו..
",עממי,-1,4,2,1886,"חמור קטן (יש אומרים בכלל אתון) ועיקש שיחד עם ראובן פצ'נובסקי (פדני) שכינויו 'רובניו' (עם אף סתום) עשה הובלות קטנות בדרכי המשק, בעיקר אוכל למטבח הורים. את מרבית הזמן בילו השניים בשכנוע הדדי ובשאלה: ""מי בכלל צריך אותנו? ולכן למה בכלל ללכת?"" (מספר 'עדי ראיה' מוכנים להשבע שראו את רובניו מחליף את החמור). המונח הנ""ל שימש בשיח ה'ברנרי' כמטאפורה לשתי סוגיות: האחת &#8211; זה נושא כה פעוט, אפילו החמור של רובניו יכול לעשותו. השניה &#8211; החוכמה שהפגנת כה פשוטה, אפילו חמורו של רובניו..
"
27,עירוניסט,"מישהו, בדרך כלל ילד שהגיע לביקור בקיבוץ 'מבחוץ'","במסגרת קידוש היחד הקיבוצי כל 'זר' נחשב ל'עירוניסט'.
לעירוניסט היו מספר תכונות שלא הותירו ספק לנחיתותו: 
א.הוא לבוש בבגדים משונים והחולצה שלו תמיד תחובה במכנסיים. 
ב.הוא עדין ורגיש מדי לשמש, לבוץ, לרעש לקללות ולמכות.
ג.שפתו מוזרה, למורה יקרא: המורה או מורתי, את אחותש'לו מכנה אחותי ובתופסת יצעק 'פוס'
ד.בקפיצה לבריכה יסתום את האף וישחה בסגנון ' גרזן', הראש מונף מצד לצד ואף פעם לא נרטב. בקיצור, שה'עירוניסט' ישאר בעיר עם דומיו ולא יתקרב לחצר הקיבוץ.",קיבוצניק,-1,4,2,1989,"במסגרת קידוש היחד הקיבוצי כל 'זר' נחשב ל'עירוניסט'.
לעירוניסט היו מספר תכונות שלא הותירו ספק לנחיתותו: 
א.הוא לבוש בבגדים משונים והחולצה שלו תמיד תחובה במכנסיים. 
ב.הוא עדין ורגיש מדי לשמש, לבוץ, לרעש לקללות ולמכות.
ג.שפתו מוזרה, למורה יקרא: המורה או מורתי, את אחותש'לו מכנה אחותי ובתופסת יצעק 'פוס'
ד.בקפיצה לבריכה יסתום את האף וישחה בסגנון ' גרזן', הראש מונף מצד לצד ואף פעם לא נרטב. בקיצור, שה'עירוניסט' ישאר בעיר עם דומיו ולא יתקרב לחצר הקיבוץ."
28,ילד חוץ,"ילד, לעיתים רחוקות ילדה, שהגיע לקיבוץ ללמוד ולחיות","כבר מהימים הראשונים של הקיבוץ, למדו בג""ב ילדים שהוריהם לא גרו בקיבוץ ולכן זכויותיהם ומעמדם נקבע בהתאם. מרבית הילדים הגיעו מצוידים ברגשי נחיתות ואם היה להם קצת בטחון עצמי, ילדי הקיבוץ דאגו להדחקתו. ילד חוץ, שתמיד דאגו להזכיר לו שהוא כזה, גם אחרי עשור שנים נראה ונשמע כ'לא שייך לנוף'. ילדי חוץ שהצליחו להשתלב בחברה - אין חיה כזו!!
",לא ברור,-1,4,2,3378,"כבר מהימים הראשונים של הקיבוץ, למדו בג""ב ילדים שהוריהם לא גרו בקיבוץ ולכן זכויותיהם ומעמדם נקבע בהתאם. מרבית הילדים הגיעו מצוידים ברגשי נחיתות ואם היה להם קצת בטחון עצמי, ילדי הקיבוץ דאגו להדחקתו. ילד חוץ, שתמיד דאגו להזכיר לו שהוא כזה, גם אחרי עשור שנים נראה ונשמע כ'לא שייך לנוף'. ילדי חוץ שהצליחו להשתלב בחברה - אין חיה כזו!!
"
